31/2020;Aquisição de divisórias e instalação de paredes de gesso acartonado nos laboratórios;2;R$ 5.700,00;PARANAVAÍ;
32/2020;Aquisição de 01 (uma) unidade do item MESA DE SOM COM 12 CANAIS, para atender às necessidades do IFPR - Campus Paranavaí;1;R$ 1.740,00;PARANAVAÍ;
33/2020;Contratação de serviços de manutenção corretiva de equipamento de laboratório (bomba de vácuo) para atender às necessidades do Eixo de Química.;1;R$ 280,00;PARANAVAÍ;
34/2020;Aquisição de Equipamentos e Materiais para Automação de Portão de Acesso do Campus Paranavaí.;13;R$ 7.490,23;PARANAVAÍ;
35/2020;Aquisição de peças e serviços para manutenção Corretiva e Preventiva Cancelas da Guarita do Campus Paranavaí;3;R$ 1.004,00;PARANAVAÍ;
36/2020;Aquisição de Peças e Serviços para Manutenção, Conservação e Instalação de Ares Condicionados do Campus Paranavaí.;16;R$ 36.180,00;PARANAVAÍ;
01/2020;O presente Termo de Referência tem por objetivo a aquisição de kits de alimentação a serem distribuídos aos alunos do IFPR - Campus Pinhais, conforme estudo de viabilidade para execução do Programa Nacional de Alimentação Escolar (PNAE) durante a pandemia do novo coronavírus, o qual encontra-se instruídos aos autos do Processo Administrativo 23411.005682/2020-62.;8;R$ 6.148,80;PINHAIS;
02/2020;Totem display personalizado para álcool gel com pedal.Display personalizado para álcool em gel, estrutura tubular em aço, com tratamento antiferrugem e pintura epóxi. Possui pedal para acionamento pelo pé sem tocar as mãos. Abertura fácil para retirada e reposição do frasco de álcool em gel. Para frasco de no mínimo 500ml. ;1;R$ 2.360,00;PINHAIS;
04/2020;Aquisição de gêneros alimentícios da agricultura familiar para atendimento ao Programa Nacional de Alimentação Escolar – PNAE.;15;R$ 1.291.500,00;PINHAIS;
05/2020;Aquisição de glicerina para produção de álcool em gel pelo IFPR - campus Pinhais;1;R$ 323,22;PINHAIS;
06/2020;Bombona 5l natural retangular tampa rosca lacre;1;R$ 44,00;PINHAIS;
07/2020;O objeto deste processo é a contratação de empresa especializada no treinamento teórico e prático para possibilitar a Formação de Brigada de Incêndio de acordo com a legislação em vigor para atender o Instituto Federal do Paraná - Campus Pinhais.;1;R$ 2.980,00;PINHAIS;
09/2020;Placas de sinalização para demarcação das áreas de circulação do Campus Pinhais para prevenção e combate à COVID-19;4;R$ 434,00;PINHAIS;
10/2020;Aquisição de gêneros alimentícios orgânicos da Agricultura Familiar e do Empreendedor Familiar Rural, para o atendimento ao Programa Nacional de Alimentação Escolar Pnae.;15;R$ 12.915,00;PINHAIS;
12/2020;Material de Limpeza e Produtos de Higienização - TAPETES SANITIZANTES EM VINIL.;2;R$ 3.105,90;PINHAIS;
13/2020;Aquisição de Álcool etílico 92,8 INPM (96° GL) para o Campus Pinhais do IFPR;1;R$ 2.900,00;PINHAIS;
14/2020;Aquisição de Trietanolamina pa.número de referência química CAS 102-71-6. Neon para o Campus Pinhais do IFPR;1;R$ 751,73;PINHAIS;
16/2020;Aquisição de 6 unidades de esguicho regulável para mangueira de incêndio.;1;R$ 568,80;PINHAIS;
17/2020;Contratação de empresa especializada em serviços de emissão de certificados digitais.;1;R$ 390,00;PINHAIS;
19/2020;Aquisição de CARBOXIMETILCELULOSE SAL SODICO (VISC.1000/2000CP) para o Campus Pinhais do IFPR - 19 Frascos de 500g;1;R$ 1.045,00;PINHAIS;
22/2020;Aquisição de Álcool etílico 92,8 INPM (96° GL) para o Campus Pinhais do IFPR;1;R$ 4.749,87;PINHAIS;
23/2020;Aquisição de Álcool etílico 92,8 INPM (96° GL) para o Campus Pinhais do IFPR;1;R$ 4.749,87;PINHAIS;
24/2020;Aquisição de barreiras de acrílico para distribuição aos diversos setores do Campus Pinhais como forma de prevenção e enfrentamento à COVID-19.;2;R$ 2.850,00;PINHAIS;
27/2020;Aquisição de Serviços de Chaveiro para o Campus Pinhais do IFPR;1;R$ 1.320,00;PINHAIS;
28/2020;Portão eletrônico (todos os equipamentos e materiais necessários para instalação, tais como: interfone, acessórios, motor) e instalação (mão-de-obra).;1;R$ 4.410,00;PINHAIS;
31/2020;Contratação de empresa especializada na instalação de mobiliário para laboratório de química com fornecimento de materiais e mão de obra necessários para execução da prestação de serviço para o IFPR – Campus Pinhais.;1;R$ 23.494,90;PINHAIS;
32/2020;"Aquisição de ""luva"" e ""tê"" em PVC para realização de conserto no campus Pinhais.";2;R$ 200,00;PINHAIS;
33/2020;"Aquisição de tubo 100mm e ""joelho"" em PVC para realização de conserto no campus Pinhais.";2;R$ 1.537,90;PINHAIS;
34/2020;Contratação de Serviços de Troca de Janela para o Campus Pinhais do IFPR;1;R$ 8.600,00;PINHAIS;
35/2020;Contratação de fundação de apoio para gerir os recursos recebidos por meio de projeto selecionado em chamada pública pela COPEL, PEE 002 - 2019.;1;R$ 17.979,36;PINHAIS;
01/2020;Aquisição de cestas básicas (kit de alimentos) para doação à alunos matriculados no ensino médio regular do IFPR - Campus Pitanga.;1;R$ 14.664,72;PITANGA;
02/2020;Contratação de pessoa jurídica para fornecimento de recarga de extintores para o IFPR - Campus Pitanga.;5;R$ 848,00;PITANGA;
03/2020;Aquisição de cestas básicas de gêneros alimentícios da Agricultura Familiar e do Empreendedor Familiar Rural, para o atendimento ao Programa Nacional de Alimentação Escolar - PNAE;1;R$ 47.222,28;PITANGA;
04/2020;Aquisição de cestas básicas de gêneros alimentícios da Agricultura Familiar e do Empreendedor Familiar Rural, para o atendimento ao Programa Nacional de Alimentação Escolar - PNAE;1;R$ 47.222,28;PITANGA;
05/2020;Contratação de empresa especializada na organização e realização do I Torneio sul brasileiro de LOL dos Institutos Federais.;1;R$ 11.010,00;PITANGA;
06/2020;Dispensa de Licitação para atender estimativa de despesas com energia elétrica do Campus Pitanga do Instituto Federal do Paraná para o Exercício de 2021.;1;R$ 96.000,00;PITANGA;
01/2019;Aquisição de materiais de manutenção predial;;R$ 1.970,00;TELÊMACO BORBA;
02/2019;Aquisição de materiais elétricos;;R$ 5.337,50;TELÊMACO BORBA;
03/2019;Instalação e manutenção de aparelhos de ar-condicionado;;R$ 1.860,00;TELÊMACO BORBA;
04/2019;Aquisição de materiais elétricos;;R$ 3.251,26;TELÊMACO BORBA;
05/2019;Curso de Formação de Brigadistas;;R$ 2.990,00;TELÊMACO BORBA;
06/2019;Fornecimento de materiais relativos a manutenção e/ou reforma predial;;R$ 2.460,33;TELÊMACO BORBA;
08/2019;Contratação de propaganda;;R$ 800,00;TELÊMACO BORBA;
10/2019;Aquisição de certificação digital e token;;R$ 1.050,00;TELÊMACO BORBA;
11/2019;Contratação de seguro predial;;R$ 4.000,00;TELÊMACO BORBA;
12/2019;Aquisição de materiais elétricos;;R$ 4.524,96;TELÊMACO BORBA;
13/2019;Aquisição de certificação digital e token;;R$ 1.212,00;TELÊMACO BORBA;
01/2020;A manutenção predial pretendida visa executar um conjunto de atividades para garantir plena capacidade e condições de funcionamento contínuo, seguro e confiável dos ambientes de trabalho institucional, preservando as características e desempenhos, mantendo o estado de uso ou de operação, bem como na recuperação deste estado, e ainda manter o patrimônio do Instituto Federal do Paraná - Campus Telêmaco Borba.;16;R$ 8.938,88;TELÊMACO BORBA;
02/2020;A aquisição se justifica para manter o abastecimento de café e açúcar, destinado para atender a demanda dos servidores, prestadores de serviço e visitantes desta instituição. ;3;R$ 1.869,99;TELÊMACO BORBA;
03/2020;A aquisição de ANILHA PARA CABO DE AÇO, CABO DE AÇO POLIDO E CLIPS PARA DE AÇO para a manutenção e conservação dos portões laterais tendo em vista a necessidade da sua ampla utilização. A aquisição de ISCA PARA FORMIGAS é necessária para o controle das formigas cortadeiras que danificam o gramado e paisagismo do campus. E a aquisição do RESERVATÓRIO PARA SABONETE é impreterivelmente necessários ao combate do COVID-19 para garantia da saúde dos funcionários do campus.  ;5;R$ 2.454,38;TELÊMACO BORBA;
04/2020;Contratação de Seguro Predial;1;R$ 4.000,00;TELÊMACO BORBA;
05/2020;Certificado e-CPF A3, validade 36 meses.;1;R$ 164,50;TELÊMACO BORBA;
07/2020;Implantação de núcleo de pesquisa, desenvolvimento e formação técnica para a Indústria 4.0 - IFPR Campus Telêmaco Borba”, que visa a Criação do Núcleo de Pesquisa e Desenvolvimento e um espaço Maker 4.0 no IFPR - Telêmaco Borba para analisar, capacitar, difundir a produção de tecnologias no Brasil, com base em estudos e projetos no escopo da Indústria 4.0.;4;R$ 49.959,80;TELÊMACO BORBA;
08/2020;Implantação de núcleo de pesquisa, desenvolvimento e formação técnica para a Indústria 4.0 - IFPR Campus Telêmaco Borba”, que visa a Criação do Núcleo de Pesquisa e Desenvolvimento e um espaço Maker 4.0 no IFPR - Telêmaco Borba para analisar, capacitar, difundir a produção de tecnologias no Brasil, com base em estudos e projetos no escopo da Indústria 4.0.;3;R$ 29.705,00;TELÊMACO BORBA;
09/2020;Implantação de núcleo de pesquisa, desenvolvimento e formação técnica para a Indústria 4.0 - IFPR Campus Telêmaco Borba”, que visa a Criação do Núcleo de Pesquisa e Desenvolvimento e um espaço Maker 4.0 no IFPR - Telêmaco Borba para analisar, capacitar, difundir a produção de tecnologias no Brasil, com base em estudos e projetos no escopo da Indústria 4.0.;1;R$ 45.450,00;TELÊMACO BORBA;
43466;Contratação de empresa para serviços de desinsetização, desratização e limpeza de caix a d'água para o Campus Umuarama;;R$ 7.600,00;UMUARAMA;
02/2019;Aquisição de material de consumo, sendo 50 metros de Fio/Cabo PP 3 x 4 mm para atender a demanda de manutenção/instalação dos ar cond icionados do campus Avançado Goioerê;;R$ 350,00;UMUARAMA;
03/2019;Contratação de empresa para serviço de manutenção e conserto de aparelhos de ar condic ionado;;R$ 1.024,00;UMUARAMA;
04/2019;Aquisição do disjuntor trifásico DIN de 100a para substituição na caixa de entrada de energia do Bloco 2, afim de evitar o aqueciment o dos fios de energia levando ao risco eminent e de incêndio no Campus;;R$ 80,00;UMUARAMA;
05/2019;"Serviço de Demarcação de Divisa entre o s lotes das Matrículas n 394 e 25.178. Utiliza ndo-se de equipamento: Estação Total a Laser ou infravermelho, GPS RTK ou Outro com colocação de ""Estacas"" para Demarcar a área do Campus Ava nçado Goioerê do IFPR. Levantamento Topográfico";;R$ 3.500,00;UMUARAMA;
06/2019;Solicitação de execução de serviço com caminhão auto fossa de capacidade 8m para real ização de esgotamento de fossa do bloco 3 e 4 d evido a transbordo.;;R$ 180,00;UMUARAMA;
07/2019;Contratação de empresa para serviços de impressão de folhas com a logo do IFPR colorid as para posterior preenchimento e impressão das carteirinhas estudantis;;R$ 150,00;UMUARAMA;
08/2019;Aquisição de material hidráulico para a tender a demanda de manutenção/reparo dos regis tros, canos e outros que estão conectados/insta lados junto as Caixas D águas do Campus;;R$ 347,12;UMUARAMA;
09/2019;Aquisição de reagentes para preparação de nanopartículas, que serão utilizados para de senvolvimento de pesquisas e dissertações ligad as ao Programa de Mestrado em Sustentabilidade IFPR/UEM;;R$ 1.505,00;UMUARAMA;
10/2019;Serviço de lanche/coffee break. Mínimo de dois tipos de salgados (variando entre sandu íches, tortas e/ou salgados assados), pão de qu eijo, dois tipos de bolo simples doce, café, re frigerante, suco natural e/ou de caixa. Forneci mento do material necessário, como mesas, toalh as, bandejas, copos, guardanapos e talheres, et c;;R$ 4.050,00;UMUARAMA;
11/2019;Contratação de empresa especializada em limpeza em altura para o Bloco 2;;R$ 6.600,00;UMUARAMA;
12/2019;Aquisição de material engarrafado (reca rga de gás) para atender a demanda do Campus Um uarama em 2019/2020. 10 unidades - Recarga de Gás GLP 13KG uso domestico 02 unidades - Reca rga de Gás GLP 45KG uso industrial;;R$ 1.367,20;UMUARAMA;
14/2019;Aquisição de materiais de consumo de Te cnologia da Informação e Comunicação para manut enção do sistema de TI do Campus Umuarama;;R$ 12.159,50;UMUARAMA;
15/2019;Aquisição de dispositivo Token e contra tação de serviço de certificação digital para o Campus Umuarama e Campus Avançado Goioerê.;;R$ 1.740,00;UMUARAMA;
16/2019;Aquisição de artigos de decoração para atender demanda do Campus Umuarama em seus even tos e formaturas;;R$ 4.095,70;UMUARAMA;
17/2019;Aquisição de cortinas de ar. CORTINA DE AR, DIMENSÕES APROXIMADAS 0,90 X 0,22 X 0,1 8 M (L X A X P) - CORTINA DE AR, DIMENSÕES A PROXIMADAS DO PRODUTO: 0,90 X 0,22 X 0,18 M (L X A X P), DEVE POSSUIR NÍVEL DE RUÍDO ENTRE AS NORMAS TÉCNICAS DA ABNT. VOLTAGEM: 220 V, POTÊN CIA: 220 W, FREQUÊNCIA: 50/60 HZ, VAZÃO DE AR a proximada (M /H): 1200, NÚMERO DE VELOCIDADES: MÍNIMO 2. COM CONTROLE REMOTO.;;R$ 1.799,96;UMUARAMA;
18/2019;Contratação de Apólice de Seguro Predia l de acordo com valores de coberturas pré defin idas;;R$ 6.873,46;UMUARAMA;
20/2019;Contratação de empresa para serviço de conserto e manutenção de bebedouro industrial.;;R$ 650,00;UMUARAMA;
21/2019;Contratação de empresa para serviços de desinsetização, desratização e limpeza de caix a d'água para o Campus Avançado Goioerê.;;R$ 1.900,00;UMUARAMA;
23/2019;Aquisição de Máquinas, Ferramentas e Ut ensílios de Oficina - Triturador de resíduos só lidos para construção civil - editais da PROEQ em 2018 e 2019;;R$ 12.705,94;UMUARAMA;
24/2019;Aquisição de Material Laboratorial - pe ças (Cartucho dessecante e Janela KBR) que serã o utilizadas para reposição no equipamento do Espectrofotômetro de Infravermelho com Transfor mada de Fourier (FTIR) - Marca referência Agile nt.;;R$ 10.746,96;UMUARAMA;
25/2019;Aquisição de Aparelhos de Medição e Ori entação e Máquinas - Decibelímetro - editais da PROEQ em 2018 e 2019.;;R$ 14.684,83;UMUARAMA;
26/2019;Aquisição de Densímetro para sedimentaç ão de solos, com bulbo simétrico, escala 0,995 a 1,050 x 0,001g/cm conforme NBR 7184 para Lab oratório de Edificações do IFPR - Campus Umuara ma;;R$ 550,00;UMUARAMA;
27/2019;Serviço para deslocamento da PRENSA DL3 0000/PC200C da parte externa do laboratório par a a parte interna, inclusos os serviços de guin cho. Instalação e colocação do equipamento em o peração. Calibração de força das células.Treina mento para colaboradores. Instalação do softwar e Tesc na versão original.;;R$ 13.750,00;UMUARAMA;
28/2019;"Serviço de calibração de força da célul a de carga capacidade 200tf em compressão para PRENSA SOLOCAP 44CIC NO360 e treinamento para c olaboradores na utilização do equipamento. Obs ervações: Não estão inclusas nenhuma peça qu e porventura apresente defeito; Incluso todas as despesas de deslocamento, hospedagem e alime ntação, km, hotel entre outras.";;R$ 3.600,00;UMUARAMA;
29/2019;Contratação de serviço de fornecimento de energia elétrica para o exercício 2020.;;R$ 295.000,00;UMUARAMA;
30/2019;Aquisição de 10 bolas de futsal para at ender o Campus Umuarama.;;R$ 2.900,00;UMUARAMA;
31/2019;Contratação de serviço de fornecimento de energia elétrica para o Campus Avançado Goio ere;;R$ 102.000,00;UMUARAMA;
32/2019;Aquisição de material para manutenção d e bens imóveis - tinta para piso.;;R$ 720,00;UMUARAMA;
33/2019;Aquisição de controle remoto universal para ar condicionado;;R$ 1.440,00;UMUARAMA;
35/2019;Contratação de empresa para serviço de conserto e manutenção de bebedouro industrial;;R$ 650,00;UMUARAMA;
01/2020;Aquisição de fonte de alimentação para câmeras de vigilância.;1;R$ 14,63;UMUARAMA;
02/2020;Aquisição de equipamento e suprimentos para confecção de protetores faciais em prevenção e combate ao COVID-19;3;R$ 11.773,00;UMUARAMA;
03/2020;Aquisição de cestas básicas (kit de alimentos) para doação à alunos matriculados no ensino médio regular do IFPR - Campus Umuarama.;1;R$ 16.435,40;UMUARAMA;
04/2020;Aquisição de cestas básicas de gêneros alimentícios da Agricultura Familiar e do Empreendedor Familiar Rural, para o atendimento ao Programa Nacional de Alimentação Escolar – PNAE;1;R$ 13.728,12;UMUARAMA;
05/2020;Aquisição de totem com display personalizado, dispensador de álcool em gel com pedal.;1;R$ 3.000,00;UMUARAMA;
06/2020;Aquisição de dispositivos de operação e armazenamento de chaves criptográficas / Certificados Digitais – Token USB e  Serviço de emissão, renovação e validação de Certificados Digitais do tipo A3 para o Campus Umuarama e Goioerê.;2;R$ 1.708,00;UMUARAMA;
08/2020;Aquisição de materiais para manutenção de bens imóveis para atender demanda do Campus Umuarama;24;R$ 3.472,40;UMUARAMA;
09/2020;Aquisição de tapetes em vinil sanitizantes para o enfrentetamento à transmissão do coronavírus, para os Campi Umuarama e Avançado Goioerê.;2;R$ 4.826,20;UMUARAMA;
10/2020;Aquisição de serviço de empresa especializada na realização de dedetização, desratização e limpeza de caixa d'água para o  Campus Umuarama;2;R$ 6.900,00;UMUARAMA;
11/2020;Contratação especializada em serviços de reparação e manutenção para troca da cobertura do pátio central do Bloco Administrativo (projeto padrão) do Campus Avançado Goioerê do IFPR, situado na Rodovia Luiz Dechiche S/N, na cidade de Goioerê do estado do Paraná.;1;R$ 58.650,22;UMUARAMA;
12/2020;Contratação de pessoa jurídica especializada na prestação de serviços de seguro predial - Conforme Termo de Referência.;1;R$ 6.668,93;UMUARAMA;
13/2020;Contratação de pessoa jurídica especializada na prestação de serviços de seguro predial. ;1;R$ 2.894,02;UMUARAMA;
14/2020;Contratação de pessoa jurídica para confecção, manutenção e instalação de trabalhos em granito, com o fornecimento de todos os materiais acessórios necessários à realização do serviço, com o objetivo de atender a demanda do IFPR - Campus Umuarama, conforme especificações descritas no termo de referência.;1;R$ 49.937,00;UMUARAMA;
15/2020;Contratação de empresa especializada na prestação de serviços de manutenção preventiva e corretiva em aparelhos de ar condicionado, com o objetivo de atender a demanda do IFPR - Campus Umuarama, conforme especificações descritas no termo de referência.;1;R$ 15.060,00;UMUARAMA;
16/2020;Aquisição de recargas para extintores de incêndio, com o objetivo de atender a demanda do IFPR - Campus Umuarama.;6;R$ 1.432,00;UMUARAMA;
17/2020;A necessidade de aquisição de materiais laboratorial e serviços de tradução, adaptação, versão e revisão de texto científicos do idioma Português para o idioma Inglês, que serão utilizados no desenvolvimento das pesquisas do Mestrado em Sustentabilidade e com finalidade de submeter seus artigos em periódicos com Qualis CAPES.;2;R$ 6.117,00;UMUARAMA;
18/2020;CONTRATAÇÃO DE SERVIÇO DE FORNECIMENTO DE ENERGIA ELÉTRICA PARA O EXERCÍCIO 2021 - IFPR Campus Umuarama;1;R$ 276.000,00;UMUARAMA;
19/2020;Contratação de empresa especializada para execução de serviço de manutenção em ar condicionado para atender a demanda do Campus Avançado Goioerê, conforme condições, quantidades e exigências estabelecidas no Termo de Referência.;1;R$ 180,00;UMUARAMA;
01/2020;Contratação de empresa especializada para Recarga de Extintores ABC 4KG e CO2 6KG, Ensaio Hidrostático de Cilindros de Exntintor de Incêndio, fornecimento de mangueira de incêndio, fornecimento e carga de botijão de gás GLP P13 e recarga de botijão GLP P45.;7;R$ 3.109,00;UNIÃO DA VITÓRIA;
02/2020;Contratação de empresa especializada em serviço comum de engenharia para reparo e recomposição das áreas afetadas por desabamento de estrutura na quadra de esportes do Campus União da Vitória;1;R$ 44.373,98;UNIÃO DA VITÓRIA;
03/2020;Contração de empresa especializada na prestação de treinamento teórico e prático para possibilitar a Formação de Brigada de Incêndio.;1;R$ 3.000,00;UNIÃO DA VITÓRIA;
01/2019;CONTRATAÇÃO DE FORNECIMENTO DE ENERGIA ELÉTRICA PARA O CAMPUS AVANÇADO BARRACÃO NO EXERCÍCIO DE 2019;1;R$ 36.000,00;REITORIA;
02/2019;CONTRATAÇÃO DE SERVIÇO DE FORNECIMENTO DE ENERGIA ELÉTRICA - CAMPUS PINHAIS PARA O EXE RCÍCIO DE 2019;;R$ 72.000,00;REITORIA;
03/2019;CONTRATAÇÃO DE SERVIÇO DE FORNECIMENTO DE ENERGIA ELÉTRICA - CAMPUS COLOMBO, EXERCÍCIO 2019;;R$ 60.000,00;REITORIA;
04/2019;CONTRATAÇÃO DE SEGURO PREDIAL PARA O CAMPUS PITANGA.;;R$ 5.448,34;REITORIA;
05/2019;CONTRATAÇÃO DE EMPRESA ESPECIALIZADA NA PRESTAÇÃO DE SERVIÇO DE LOCAÇÃO DE NOBREAK PARA O DATA CENTER INSTITUCIONAL POR 8 MESES.;;R$ 16.800,00;REITORIA;
06/2019;CONTRATAÇÃO DE FORNECIMENTO DE ENERGIA ELÉTRICA COM CONCESSIONÁRIO AUTORIZADO AO IFPR C. JAGUARIAÍVA;;R$ 52.800,00;REITORIA;
07/2019;CONTRATAÇÃO DE SEGURO TOTAL COM ASSISTÊ NCIA 24 (VINTE E QUATRO) HORAS PARA COBERTURA D O VEÍCULO PERTENCENTE AO IFPR C. AVANÇADO BARRACÃO;;R$ 4.428,56;REITORIA;
08/2019;FORNECIMENTO DE ENERGIA ELÉTRICA PARA A TENDER O CAMPUS UNIÃO DA VITÓRIA DO IFPR NO EXERCÍCIO DE 2019;;R$ 45.000,00;REITORIA;
09/2019;CONTRATAÇÃO DE EMPRESA ESPECIALIZADA NO FORNECIMENTO DE RECARGA DE EXTINTORES E REALIZAÇÃO DE TESTE HIDROSTÁTICO PARA O INSTITUTO FEDERAL DO PARANÁ CAMPUS CAPANEMA.;;R$ 1.475,00;REITORIA;
10/2019;CONTRATAÇÃO DE FORNECIMENTO DE ENERGIA ELÉTRICA PARA O CAMPUS CAPANEMA NO EXERCÍCIO DE 2019.;;R$ 102.000,00;REITORIA;
11/2019;MANUTENÇÃO DE BENS IMÓVEIS, REPARO DE JANELAS DO TIPO MAXIM-ARES, TROCA DE BRAÇOS E AJUSTE DOS ESQUADROS;;R$ 1.100,00;REITORIA;
12/2019;CONTRATAÇÃO DE SERVIÇO DE RETIRADA DE RESÍDUOS VEGETAIS ATRAVÉS DE CAÇAMBAS DE 5M³.;;R$ 1.800,00;REITORIA;
13/2019;CONTRATAÇÃO DE EMPRESA ESPECIALIZADA NA PRESTAÇÃO DE SERVIÇOS DE LEVANTAMENTO TOPOGRÁFICO PLANIALTIMÉTRICO GEORREFERENCIADO;;R$ 5.250,00;REITORIA;
14/2019;CONTRATAÇÃO DE EMPRESA ESPECIALIZADA NO FORNECIMENTO DE GÊNEROS ALIMENTÍCIOS (AÇÚCAR REFINADO), CONSTITUÍDO FUNDAMENTALMENTE POR SUCO DE CANA-DE-AÇÚCAR, CONTENDO NO MÍNIMO 98,5 % DE SACAROSE, COM ASPECTO SÓLIDO E CRISTAIS BE M DEFINIDOS, COR BRANCA, ODOR E SABOR PRÓPRIOS DO PRODUTO, LIVRE DE FERMENTAÇÃO, SEM UMIDADE, SEM EMPEDRAMENTOS, ISENTO DE MATÉRIA TERROSA, D E PARASITAS E DE DETRITOS ANIMAIS OU VEGETAIS, COM EMBALAGEM PRIMÁRIA PLÁSTICA RESISTENTE QUE GARANTA A INTEGRIDADE DO PRODUTO ATÉ O CONSUMO;;R$ 555,00;REITORIA;
15/2019;CONTRATAÇÃO DE EMPRESA ESPECIALIZADA NO FORNECIMENTO DE RECARGA DE EXTINTORES E REALIZAÇÃO DE TESTE HIDROSTÁTICO PARA O INSTITUTO FEDERAL DO PARANÁ CAMPUS CAPANEMA.;;R$ 1.475,00;REITORIA;
16/2019;O PRESENTE PROCESSO TEM POR OBJETIVO A CONTRATAÇÃO DE EMPRESA ESPECIALIZADA NO FORNECIMENTO DE RECARGA DE EXTINTORES E REALIZAÇÃO DE MANUTENÇÃO EM EXTINTORES PARA O INSTITUTO FEDERAL DO PARANÁ CAMPUS PINHAIS.;;R$ 590,00;REITORIA;
17/2019;CONTRATAÇÃO DE EMPRESA ESPECIALIZADA EM PRESTAÇÃO DE SERVIÇOS RELATIVOS A SEGURO PREDIAL PARA O INSTITUTO FEDERAL DO PARANÁ, CAMPUS CAPANEMA;;R$ 1.797,55;REITORIA;
18/2019;CONTRATAÇÃO DE SERVIÇO DE MANUTENÇÃO ELÉTRICA EMERGENCIAL NO EDIFÍCIO AROEIRA;;R$ 5.890,00;REITORIA;
19/2019;CONTRATAÇÃO DE SERVIÇOS PRESTADOS POR ENTIDADE COM NOTÓRIA ESPECIALIZAÇÃO PARA A REALIZAÇÃO DE CONCURSO PÚBLICO DO IFPR;;R$ 5.890,00;REITORIA;
20/2019;CONTRATAÇÃO DE AUTOMATISMO DE PORTÃO PA RA O CAMPUS PINHAIS DO IFPR.;;R$ 3.660,00;REITORIA;
21/2019;AQUISIÇÃO DE ITENS PARA ADEQUAÇÃO DOS ESTÚDIOS AUDIOVISUAIS PARA USO DO NOBREAK.;;R$ 3.231,83;REITORIA;
22/2019;AQUISIÇÃO DE TUBULAÇÃO E BANDEJAS PARA INSTALAÇÃO DE AR CONDICIONADO DO DATA CENTER DO IFPR;;R$ 3.064,00;REITORIA;
23/2019;SERVIÇO DE PLANEJAMENTO, ORGANIZAÇÃO, O PERACIONALIZAÇÃO E ACOMPANHAMENTO DO PROCESSO S ELETIVO IFPR 2020;;R$ 1.030.949,00;REITORIA;
24/2019;SEGURO EMPRESARIAL PREDIAL DO CAMPUS JAGUARIAÍVA;;R$ 3.176,39;REITORIA;
25/2019;CONTRATAÇÃO DE EMPRESA ESPECIALIZADA NA PRESTAÇÃO DE SERVIÇOS DE EMISSÃO/ RENOVAÇÃO DE CERTIFICAÇÃO DIGITAL;;R$ 4.459,00;REITORIA;
26/2019;CONSULTORIA TÉCNICA PARA A ELABORAÇÃO D E TERMO DE REFERÊNCIA PARA COMPOR O EDITAL/INSTRUMENTO CONVOCATÓRIO DA LICITAÇÃO DE SERVIÇOS D E TRATAMENTO E ISOLAMENTO ACÚSTICO PARA DOIS ESTÚDIOS DE GRAVAÇÃO AUDIOVISUAL, NECESSÁRIOS PAR A ATENDER A DEMANDA DA DIRETORIA DE EDUCAÇÃO A DISTÂNCIA DO INSTITUTO FEDERAL DO PARANÁ - IFPR , CONFORME CONDIÇÕES, QUANTIDADES, EXIGÊNCIAS E ESTIMATIVAS ESTABELECIDAS NO TERMO DE REFERÊNCIA.;;R$ 9.480,00;REITORIA;
28/2019;CONTRATAÇÃO DE EMPRESA ESPECIALIZADA NA PRESTAÇÃO CONTINUADA DE VIGILÂNCIA PATRIMONIAL POR MEIO DE MONITORAMENTE ELETRÔNICO;;R$ 17.394,00;REITORIA;
29/2019;SERVIÇOS DE DESMONTAGEM DE DIVISÓRIAS, MONTAGEM COM FORNECIMENTO DE DIVISÓRIAS E COBERTURA EM FORRO DE PVC PARA ABRIGAR O ACERVO ARQUIVÍSTICO INSTITUCIONAL NO ESPAÇO DISPONIBILIZADO PELO EAD, DE FORMA APROPRIADA EM LOCAL DE ACESSO RESTRITO;;R$ 17.600,00;REITORIA;
30/2019;CONTRATAÇÃO DE EMPRESA ESPECIALIZADA PARA A PRESTAÇÃO DE SERVIÇOS DE SEGURO PREDIAL DO C. UNIÃO DA VITÓRIA.;;R$ 2.277,87;REITORIA;
32/2019;SEGURO PREDIAL EAD;;R$ 2.092,07;REITORIA;
37/2019;CONTRATAÇÃO DE SERVIÇOS DE CERTIFICAÇÃO DIGITAL, SEGUNDO AS NORMAS DA ICP-BRASIL (INFR AESTRUTURA DE CHAVES PÚBLICAS BRASILEIRAS) COMP REENDENDO A EMISSÃO DE CERTIFICADOS DIGITAIS CO M O FORNECIMENTO DA MÍDIA DE ARMAZENAMENTO (TOK EN) E RENOVAÇÃO DE CERTIFICADOS DIGITAIS PARA A TENDER AS NECESSIDADES DO IFPR.;;R$ 9.135,00;REITORIA;
